14:46:40.809463 IP 192.168.56.1.57621 > 192.168.56.255.57621: UDP, length 44
14:47:07.275197 IP 192.168.56.1.mdns > mdns.mcast.net.mdns: 0 PTR (QM)? _spotify-connect._tcp.local. (45)
14:47:07.277838 IP6 fe80::7ac9:20a1:db14:bb9a.mdns > ff02::fb.mdns: 0 PTR (QM)? _spotify-connect._tcp.local. (45)
14:47:10.807995 IP 192.168.56.1.60342 > 239.255.255.250.1900: UDP, length 125
14:47:24.119539 IP 192.168.56.1.57621 > 192.168.56.255.57621: UDP, length 44
14:47:39.581336 IP 192.168.56.1.51540 > 239.255.255.250.1900: UDP, length 170
14:47:40.581793 IP 192.168.56.1.51540 > 239.255.255.250.1900: UDP, length 170
14:47:41.582174 IP 192.168.56.1.51540 > 239.255.255.250.1900: UDP, length 170
14:47:42.582749 IP 192.168.56.1.51540 > 239.255.255.250.1900: UDP, length 170
14:47:48.709647 IP 192.168.56.1.58510 > 239.255.255.250.1900: UDP, length 175
14:47:49.711124 IP 192.168.56.1.58510 > 239.255.255.250.1900: UDP, length 175
14:47:50.712227 IP 192.168.56.1.58510 > 239.255.255.250.1900: UDP, length 175
14:47:51.712747 IP 192.168.56.1.58510 > 239.255.255.250.1900: UDP, length 175
14:47:57.605234 IP 192.168.56.1.57621 > 192.168.56.255.57621: UDP, length 44
14:48:14.688320 IP6 fe80::5f2c:50a7:b36:4049.mdns > ff02::fb.mdns: 0 [2q] PTR (QM)? _ipps._tcp.local. PTR (QM)? _ipp._tcp.local. (45)
14:48:14.689319 IP 192.168.56.117.mdns > mdns.mcast.net.mdns: 0 [2q] PTR (QM)? _ipps._tcp.local. PTR (QM)? _ipp._tcp.local. (45)
14:48:15.190762 IP6 server1.mdns > ff02::fb.mdns: 0 [2q] PTR (QM)? _ipps._tcp.local. PTR (QM)? _ipp._tcp.local. (45)
14:48:15.191086 IP server1.mdns > mdns.mcast.net.mdns: 0 [2q] PTR (QM)? _ipps._tcp.local. PTR (QM)? _ipp._tcp.local. (45)
14:48:27.601794 IP 192.168.56.1.57621 > 192.168.56.255.57621: UDP, length 44
14:48:57.602744 IP 192.168.56.1.57621 > 192.168.56.255.57621: UDP, length 44
14:49:07.276924 IP 192.168.56.1.mdns > mdns.mcast.net.mdns: 0 PTR (QM)? _spotify-connect._tcp.local. (45)
14:49:07.279519 IP6 fe80::7ac9:20a1:db14:bb9a.mdns > ff02::fb.mdns: 0 PTR (QM)? _spotify-connect._tcp.local. (45)
14:49:10.809687 IP 192.168.56.1.60342 > 239.255.255.250.1900: UDP, length 125
14:49:27.611584 IP 192.168.56.1.57621 > 192.168.56.255.57621: UDP, length 44
14:49:39.582345 IP 192.168.56.1.54259 > 239.255.255.250.1900: UDP, length 170
14:49:40.583621 IP 192.168.56.1.54259 > 239.255.255.250.1900: UDP, length 170
14:49:41.584183 IP 192.168.56.1.54259 > 239.255.255.250.1900: UDP, length 170
14:49:42.584415 IP 192.168.56.1.54259 > 239.255.255.250.1900: UDP, length 170
14:49:48.710663 IP 192.168.56.1.54262 > 239.255.255.250.1900: UDP, length 175
14:49:49.712415 IP 192.168.56.1.54262 > 239.255.255.250.1900: UDP, length 175
14:49:50.713054 IP 192.168.56.1.54262 > 239.255.255.250.1900: UDP, length 175
14:49:51.713943 IP 192.168.56.1.54262 > 239.255.255.250.1900: UDP, length 175
14:49:57.604665 IP 192.168.56.1.57621 > 192.168.56.255.57621: UDP, length 44
14:50:08.295279 IP server1.bootpc > 192.168.56.100.bootps: BOOTP/DHCP, Request from 08:00:27:86:f6:1f (oui Unknown), length 285
14:50:08.303696 IP 192.168.56.100.bootps > server1.bootpc: BOOTP/DHCP, Reply, length 548
14:50:13.606909 ARP, Request who-has 192.168.56.100 tell server1, length 28
14:50:13.607355 ARP, Reply 192.168.56.100 is-at 08:00:27:0d:b2:d3 (oui Unknown), length 46
14:50:27.605885 IP 192.168.56.1.57621 > 192.168.56.255.57621: UDP, length 44
14:50:57.611981 IP 192.168.56.1.57621 > 192.168.56.255.57621: UDP, length 44
14:51:07.276900 IP 192.168.56.1.mdns > mdns.mcast.net.mdns: 0 PTR (QM)? _spotify-connect._tcp.local. (45)
14:51:07.279096 IP6 fe80::7ac9:20a1:db14:bb9a.mdns > ff02::fb.mdns: 0 PTR (QM)? _spotify-connect._tcp.local. (45)
14:51:10.810182 IP 192.168.56.1.60342 > 239.255.255.250.1900: UDP, length 125
14:51:27.657692 IP 192.168.56.1.57621 > 192.168.56.255.57621: UDP, length 44
14:51:39.578997 IP 192.168.56.1.51296 > 239.255.255.250.1900: UDP, length 170
14:51:40.579662 IP 192.168.56.1.51296 > 239.255.255.250.1900: UDP, length 170
14:51:41.580282 IP 192.168.56.1.51296 > 239.255.255.250.1900: UDP, length 170
14:51:42.581018 IP 192.168.56.1.51296 > 239.255.255.250.1900: UDP, length 170
14:51:48.718551 IP 192.168.56.1.62427 > 239.255.255.250.1900: UDP, length 175
14:51:49.715106 IP 192.168.56.1.62427 > 239.255.255.250.1900: UDP, length 175
14:51:50.716331 IP 192.168.56.1.62427 > 239.255.255.250.1900: UDP, length 175
14:51:51.716848 IP 192.168.56.1.62427 > 239.255.255.250.1900: UDP, length 175
14:51:57.658741 IP 192.168.56.1.57621 > 192.168.56.255.57621: UDP, length 44
14:52:27.659964 IP 192.168.56.1.57621 > 192.168.56.255.57621: UDP, length 44
14:52:54.251037 LLDP, length 46
14:52:57.660923 IP 192.168.56.1.57621 > 192.168.56.255.57621: UDP, length 44
14:53:07.275973 IP 192.168.56.1.mdns > mdns.mcast.net.mdns: 0 PTR (QM)? _spotify-connect._tcp.local. (45)
14:53:07.277609 IP6 fe80::7ac9:20a1:db14:bb9a.mdns > ff02::fb.mdns: 0 PTR (QM)? _spotify-connect._tcp.local. (45)
14:53:10.811964 IP 192.168.56.1.60342 > 239.255.255.250.1900: UDP, length 125
14:53:27.662050 IP 192.168.56.1.57621 > 192.168.56.255.57621: UDP, length 44
14:53:39.580842 IP 192.168.56.1.53389 > 239.255.255.250.1900: UDP, length 170
14:53:40.581831 IP 192.168.56.1.53389 > 239.255.255.250.1900: UDP, length 170
14:53:41.582267 IP 192.168.56.1.53389 > 239.255.255.250.1900: UDP, length 170
14:53:42.581957 IP 192.168.56.1.53389 > 239.255.255.250.1900: UDP, length 170
14:53:48.714452 IP 192.168.56.1.53391 > 239.255.255.250.1900: UDP, length 175
14:53:49.715210 IP 192.168.56.1.53391 > 239.255.255.250.1900: UDP, length 175
14:53:50.716285 IP 192.168.56.1.53391 > 239.255.255.250.1900: UDP, length 175
14:53:51.716427 IP 192.168.56.1.53391 > 239.255.255.250.1900: UDP, length 175
14:53:57.665329 IP 192.168.56.1.57621 > 192.168.56.255.57621: UDP, length 44
14:54:23.387030 IP 192.168.56.1.mdns > mdns.mcast.net.mdns: 0 PTR (QM)? _sleep-proxy._udp.local. (41)
14:54:27.664971 IP 192.168.56.1.57621 > 192.168.56.255.57621: UDP, length 44
14:54:57.666080 IP 192.168.56.1.57621 > 192.168.56.255.57621: UDP, length 44
14:55:07.273250 IP 192.168.56.1.mdns > mdns.mcast.net.mdns: 0 PTR (QM)? _spotify-connect._tcp.local. (45)
14:55:07.274336 IP6 fe80::7ac9:20a1:db14:bb9a.mdns > ff02::fb.mdns: 0 PTR (QM)? _spotify-connect._tcp.local. (45)
14:55:08.305100 IP server1.bootpc > 192.168.56.100.bootps: BOOTP/DHCP, Request from 08:00:27:86:f6:1f (oui Unknown), length 285
14:55:08.308286 IP 192.168.56.100.bootps > server1.bootpc: BOOTP/DHCP, Reply, length 548
14:55:10.807807 IP 192.168.56.1.60342 > 239.255.255.250.1900: UDP, length 125
14:55:13.502555 ARP, Request who-has 192.168.56.100 tell server1, length 28
14:55:13.502698 ARP, Reply 192.168.56.100 is-at 08:00:27:0d:b2:d3 (oui Unknown), length 46
14:55:27.666540 IP 192.168.56.1.57621 > 192.168.56.255.57621: UDP, length 44
14:55:39.587237 IP 192.168.56.1.63203 > 239.255.255.250.1900: UDP, length 170
14:55:40.588314 IP 192.168.56.1.63203 > 239.255.255.250.1900: UDP, length 170
14:55:41.589624 IP 192.168.56.1.63203 > 239.255.255.250.1900: UDP, length 170
14:55:42.589485 IP 192.168.56.1.63203 > 239.255.255.250.1900: UDP, length 170
14:55:48.716227 IP 192.168.56.1.50243 > 239.255.255.250.1900: UDP, length 175
14:55:49.717473 IP 192.168.56.1.50243 > 239.255.255.250.1900: UDP, length 175
14:55:50.717856 IP 192.168.56.1.50243 > 239.255.255.250.1900: UDP, length 175
14:55:51.718902 IP 192.168.56.1.50243 > 239.255.255.250.1900: UDP, length 175
14:55:57.666389 IP 192.168.56.1.57621 > 192.168.56.255.57621: UDP, length 44
14:56:27.667396 IP 192.168.56.1.57621 > 192.168.56.255.57621: UDP, length 44
14:56:57.667922 IP 192.168.56.1.57621 > 192.168.56.255.57621: UDP, length 44
14:57:07.278655 IP 192.168.56.1.mdns > mdns.mcast.net.mdns: 0 PTR (QM)? _spotify-connect._tcp.local. (45)
14:57:07.281232 IP6 fe80::7ac9:20a1:db14:bb9a.mdns > ff02::fb.mdns: 0 PTR (QM)? _spotify-connect._tcp.local. (45)
14:57:10.808605 IP 192.168.56.1.60342 > 239.255.255.250.1900: UDP, length 125
14:57:27.673903 IP 192.168.56.1.57621 > 192.168.56.255.57621: UDP, length 44
14:57:39.583463 IP 192.168.56.1.63736 > 239.255.255.250.1900: UDP, length 170
14:57:40.580065 IP 192.168.56.1.63736 > 239.255.255.250.1900: UDP, length 170
14:57:41.581066 IP 192.168.56.1.63736 > 239.255.255.250.1900: UDP, length 170
14:57:42.581211 IP 192.168.56.1.63736 > 239.255.255.250.1900: UDP, length 170
14:57:48.706660 IP 192.168.56.1.56605 > 239.255.255.250.1900: UDP, length 175
14:57:49.709343 IP 192.168.56.1.56605 > 239.255.255.250.1900: UDP, length 175
14:57:50.709908 IP 192.168.56.1.56605 > 239.255.255.250.1900: UDP, length 175
14:57:51.709816 IP 192.168.56.1.56605 > 239.255.255.250.1900: UDP, length 175
14:57:57.669013 IP 192.168.56.1.57621 > 192.168.56.255.57621: UDP, length 44
14:58:27.674099 IP 192.168.56.1.57621 > 192.168.56.255.57621: UDP, length 44
14:58:57.671395 IP 192.168.56.1.57621 > 192.168.56.255.57621: UDP, length 44
14:59:07.279051 IP 192.168.56.1.mdns > mdns.mcast.net.mdns: 0 PTR (QM)? _spotify-connect._tcp.local. (45)
14:59:07.282277 IP6 fe80::7ac9:20a1:db14:bb9a.mdns > ff02::fb.mdns: 0 PTR (QM)? _spotify-connect._tcp.local. (45)
14:59:10.811561 IP 192.168.56.1.60342 > 239.255.255.250.1900: UDP, length 125
14:59:27.671933 IP 192.168.56.1.57621 > 192.168.56.255.57621: UDP, length 44
14:59:39.588961 IP 192.168.56.1.56030 > 239.255.255.250.1900: UDP, length 170
14:59:40.590565 IP 192.168.56.1.56030 > 239.255.255.250.1900: UDP, length 170
14:59:41.591635 IP 192.168.56.1.56030 > 239.255.255.250.1900: UDP, length 170
14:59:42.592566 IP 192.168.56.1.56030 > 239.255.255.250.1900: UDP, length 170
14:59:48.716164 IP 192.168.56.1.64225 > 239.255.255.250.1900: UDP, length 175
14:59:49.718708 IP 192.168.56.1.64225 > 239.255.255.250.1900: UDP, length 175
14:59:50.718439 IP 192.168.56.1.64225 > 239.255.255.250.1900: UDP, length 175
14:59:51.719109 IP 192.168.56.1.64225 > 239.255.255.250.1900: UDP, length 175
14:59:57.674084 IP 192.168.56.1.57621 > 192.168.56.255.57621: UDP, length 44
15:00:08.319583 IP server1.bootpc > 192.168.56.100.bootps: BOOTP/DHCP, Request from 08:00:27:86:f6:1f (oui Unknown), length 285
15:00:08.327959 IP 192.168.56.100.bootps > server1.bootpc: BOOTP/DHCP, Reply, length 548
15:00:13.513437 ARP, Request who-has 192.168.56.100 tell server1, length 28
15:00:13.513979 ARP, Reply 192.168.56.100 is-at 08:00:27:0d:b2:d3 (oui Unknown), length 46
15:00:20.959343 IP 192.168.56.1.netbios-ns > 192.168.56.255.netbios-ns: UDP, length 50
15:00:21.709344 IP 192.168.56.1.netbios-ns > 192.168.56.255.netbios-ns: UDP, length 50
15:00:22.459668 IP 192.168.56.1.netbios-ns > 192.168.56.255.netbios-ns: UDP, length 50
15:00:25.737872 IP 192.168.56.1.netbios-ns > 192.168.56.255.netbios-ns: UDP, length 50
15:00:26.488443 IP 192.168.56.1.netbios-ns > 192.168.56.255.netbios-ns: UDP, length 50
15:00:27.239332 IP 192.168.56.1.netbios-ns > 192.168.56.255.netbios-ns: UDP, length 50
15:00:27.675851 IP 192.168.56.1.57621 > 192.168.56.255.57621: UDP, length 44
15:00:57.676994 IP 192.168.56.1.57621 > 192.168.56.255.57621: UDP, length 44
15:01:07.278283 IP 192.168.56.1.mdns > mdns.mcast.net.mdns: 0 PTR (QM)? _spotify-connect._tcp.local. (45)
15:01:07.280657 IP6 fe80::7ac9:20a1:db14:bb9a.mdns > ff02::fb.mdns: 0 PTR (QM)? _spotify-connect._tcp.local. (45)
15:01:10.811649 IP 192.168.56.1.60342 > 239.255.255.250.1900: UDP, length 125
15:01:27.677700 IP 192.168.56.1.57621 > 192.168.56.255.57621: UDP, length 44
15:01:39.590060 IP 192.168.56.1.59095 > 239.255.255.250.1900: UDP, length 170
15:01:40.590593 IP 192.168.56.1.59095 > 239.255.255.250.1900: UDP, length 170
15:01:41.590671 IP 192.168.56.1.59095 > 239.255.255.250.1900: UDP, length 170
15:01:42.590893 IP 192.168.56.1.59095 > 239.255.255.250.1900: UDP, length 170
15:01:48.719170 IP 192.168.56.1.59097 > 239.255.255.250.1900: UDP, length 175
15:01:49.720609 IP 192.168.56.1.59097 > 239.255.255.250.1900: UDP, length 175
15:01:50.721028 IP 192.168.56.1.59097 > 239.255.255.250.1900: UDP, length 175
15:01:51.720984 IP 192.168.56.1.59097 > 239.255.255.250.1900: UDP, length 175
15:01:57.681233 IP 192.168.56.1.57621 > 192.168.56.255.57621: UDP, length 44
15:02:27.681651 IP 192.168.56.1.57621 > 192.168.56.255.57621: UDP, length 44
15:02:57.679162 IP 192.168.56.1.57621 > 192.168.56.255.57621: UDP, length 44
15:03:07.277644 IP 192.168.56.1.mdns > mdns.mcast.net.mdns: 0 PTR (QM)? _spotify-connect._tcp.local. (45)
15:03:07.280054 IP6 fe80::7ac9:20a1:db14:bb9a.mdns > ff02::fb.mdns: 0 PTR (QM)? _spotify-connect._tcp.local. (45)
15:03:10.816442 IP 192.168.56.1.60342 > 239.255.255.250.1900: UDP, length 125
15:03:27.681254 IP 192.168.56.1.57621 > 192.168.56.255.57621: UDP, length 44
15:03:39.590361 IP 192.168.56.1.63741 > 239.255.255.250.1900: UDP, length 170
15:03:40.592298 IP 192.168.56.1.63741 > 239.255.255.250.1900: UDP, length 170
15:03:41.592478 IP 192.168.56.1.63741 > 239.255.255.250.1900: UDP, length 170
15:03:42.592551 IP 192.168.56.1.63741 > 239.255.255.250.1900: UDP, length 170
15:03:48.719265 IP 192.168.56.1.63743 > 239.255.255.250.1900: UDP, length 175
15:03:49.720259 IP 192.168.56.1.63743 > 239.255.255.250.1900: UDP, length 175
15:03:50.722132 IP 192.168.56.1.63743 > 239.255.255.250.1900: UDP, length 175
15:03:51.722441 IP 192.168.56.1.63743 > 239.255.255.250.1900: UDP, length 175
15:03:57.681291 IP 192.168.56.1.57621 > 192.168.56.255.57621: UDP, length 44
15:04:27.693693 IP 192.168.56.1.57621 > 192.168.56.255.57621: UDP, length 44
15:04:57.683666 IP 192.168.56.1.57621 > 192.168.56.255.57621: UDP, length 44
15:05:07.279135 IP 192.168.56.1.mdns > mdns.mcast.net.mdns: 0 PTR (QM)? _spotify-connect._tcp.local. (45)
15:05:07.281880 IP6 fe80::7ac9:20a1:db14:bb9a.mdns > ff02::fb.mdns: 0 PTR (QM)? _spotify-connect._tcp.local. (45)
15:05:08.334672 IP server1.bootpc > 192.168.56.100.bootps: BOOTP/DHCP, Request from 08:00:27:86:f6:1f (oui Unknown), length 285
15:05:08.387359 IP 192.168.56.100.bootps > server1.bootpc: BOOTP/DHCP, Reply, length 548
15:05:10.815355 IP 192.168.56.1.60342 > 239.255.255.250.1900: UDP, length 125
15:05:13.567180 ARP, Request who-has 192.168.56.100 tell server1, length 28
15:05:13.567677 ARP, Reply 192.168.56.100 is-at 08:00:27:0d:b2:d3 (oui Unknown), length 46
15:05:27.684003 IP 192.168.56.1.57621 > 192.168.56.255.57621: UDP, length 44
15:05:39.592214 IP 192.168.56.1.49851 > 239.255.255.250.1900: UDP, length 170
15:05:40.593964 IP 192.168.56.1.49851 > 239.255.255.250.1900: UDP, length 170
15:05:41.593758 IP 192.168.56.1.49851 > 239.255.255.250.1900: UDP, length 170
15:05:42.594585 IP 192.168.56.1.49851 > 239.255.255.250.1900: UDP, length 170
15:05:48.719582 IP 192.168.56.1.61968 > 239.255.255.250.1900: UDP, length 175
15:05:49.720635 IP 192.168.56.1.61968 > 239.255.255.250.1900: UDP, length 175
15:05:50.720984 IP 192.168.56.1.61968 > 239.255.255.250.1900: UDP, length 175
15:05:51.721240 IP 192.168.56.1.61968 > 239.255.255.250.1900: UDP, length 175
15:05:57.686165 IP 192.168.56.1.57621 > 192.168.56.255.57621: UDP, length 44
15:06:27.686485 IP 192.168.56.1.57621 > 192.168.56.255.57621: UDP, length 44
15:06:57.687576 IP 192.168.56.1.57621 > 192.168.56.255.57621: UDP, length 44
15:07:07.279369 IP 192.168.56.1.mdns > mdns.mcast.net.mdns: 0 PTR (QM)? _spotify-connect._tcp.local. (45)
15:07:07.281722 IP6 fe80::7ac9:20a1:db14:bb9a.mdns > ff02::fb.mdns: 0 PTR (QM)? _spotify-connect._tcp.local. (45)
15:07:10.816170 IP 192.168.56.1.60342 > 239.255.255.250.1900: UDP, length 125
15:07:27.687918 IP 192.168.56.1.57621 > 192.168.56.255.57621: UDP, length 44
15:07:39.592652 IP 192.168.56.1.57837 > 239.255.255.250.1900: UDP, length 170
15:07:40.593935 IP 192.168.56.1.57837 > 239.255.255.250.1900: UDP, length 170
15:07:41.594442 IP 192.168.56.1.57837 > 239.255.255.250.1900: UDP, length 170
15:07:42.595354 IP 192.168.56.1.57837 > 239.255.255.250.1900: UDP, length 170
15:07:48.721965 IP 192.168.56.1.57839 > 239.255.255.250.1900: UDP, length 175
15:07:49.724087 IP 192.168.56.1.57839 > 239.255.255.250.1900: UDP, length 175
15:07:50.724978 IP 192.168.56.1.57839 > 239.255.255.250.1900: UDP, length 175
15:07:51.727054 IP 192.168.56.1.57839 > 239.255.255.250.1900: UDP, length 175
15:07:57.689535 IP 192.168.56.1.57621 > 192.168.56.255.57621: UDP, length 44
15:08:27.690972 IP 192.168.56.1.57621 > 192.168.56.255.57621: UDP, length 44
15:08:39.098609 LLDP, length 46
15:08:57.691251 IP 192.168.56.1.57621 > 192.168.56.255.57621: UDP, length 44
15:09:07.278991 IP 192.168.56.1.mdns > mdns.mcast.net.mdns: 0 PTR (QM)? _spotify-connect._tcp.local. (45)
15:09:07.281612 IP6 fe80::7ac9:20a1:db14:bb9a.mdns > ff02::fb.mdns: 0 PTR (QM)? _spotify-connect._tcp.local. (45)
15:09:10.815029 IP 192.168.56.1.60342 > 239.255.255.250.1900: UDP, length 125
15:09:27.693390 IP 192.168.56.1.57621 > 192.168.56.255.57621: UDP, length 44
15:09:39.594139 IP 192.168.56.1.59512 > 239.255.255.250.1900: UDP, length 170
15:09:40.595121 IP 192.168.56.1.59512 > 239.255.255.250.1900: UDP, length 170
15:09:41.595628 IP 192.168.56.1.59512 > 239.255.255.250.1900: UDP, length 170
15:09:42.596038 IP 192.168.56.1.59512 > 239.255.255.250.1900: UDP, length 170
15:09:48.722066 IP 192.168.56.1.59515 > 239.255.255.250.1900: UDP, length 175
15:09:49.724497 IP 192.168.56.1.59515 > 239.255.255.250.1900: UDP, length 175
15:09:50.725970 IP 192.168.56.1.59515 > 239.255.255.250.1900: UDP, length 175
15:09:51.728337 IP 192.168.56.1.59515 > 239.255.255.250.1900: UDP, length 175
15:09:57.692879 IP 192.168.56.1.57621 > 192.168.56.255.57621: UDP, length 44
15:10:08.382792 IP server1.bootpc > 192.168.56.100.bootps: BOOTP/DHCP, Request from 08:00:27:86:f6:1f (oui Unknown), length 285
15:10:08.391431 IP 192.168.56.100.bootps > server1.bootpc: BOOTP/DHCP, Reply, length 548
15:10:13.643384 ARP, Request who-has 192.168.56.100 tell server1, length 28
15:10:13.643927 ARP, Reply 192.168.56.100 is-at 08:00:27:0d:b2:d3 (oui Unknown), length 46
15:10:27.693731 IP 192.168.56.1.57621 > 192.168.56.255.57621: UDP, length 44
15:10:57.697195 IP 192.168.56.1.57621 > 192.168.56.255.57621: UDP, length 44
15:11:07.278147 IP 192.168.56.1.mdns > mdns.mcast.net.mdns: 0 PTR (QM)? _spotify-connect._tcp.local. (45)
15:11:07.280953 IP6 fe80::7ac9:20a1:db14:bb9a.mdns > ff02::fb.mdns: 0 PTR (QM)? _spotify-connect._tcp.local. (45)
15:11:10.815192 IP 192.168.56.1.60342 > 239.255.255.250.1900: UDP, length 125
15:11:27.694160 IP 192.168.56.1.57621 > 192.168.56.255.57621: UDP, length 44
15:11:39.593675 IP 192.168.56.1.57603 > 239.255.255.250.1900: UDP, length 170
15:11:40.595818 IP 192.168.56.1.57603 > 239.255.255.250.1900: UDP, length 170
15:11:41.595821 IP 192.168.56.1.57603 > 239.255.255.250.1900: UDP, length 170
15:11:42.596548 IP 192.168.56.1.57603 > 239.255.255.250.1900: UDP, length 170
15:11:48.721139 IP 192.168.56.1.54475 > 239.255.255.250.1900: UDP, length 175
15:11:49.722568 IP 192.168.56.1.54475 > 239.255.255.250.1900: UDP, length 175
15:11:50.724096 IP 192.168.56.1.54475 > 239.255.255.250.1900: UDP, length 175
15:11:51.724346 IP 192.168.56.1.54475 > 239.255.255.250.1900: UDP, length 175
15:11:57.693896 IP 192.168.56.1.57621 > 192.168.56.255.57621: UDP, length 44
15:12:27.693638 IP 192.168.56.1.57621 > 192.168.56.255.57621: UDP, length 44
15:12:57.693199 IP 192.168.56.1.57621 > 192.168.56.255.57621: UDP, length 44
15:13:07.275783 IP 192.168.56.1.mdns > mdns.mcast.net.mdns: 0 PTR (QM)? _spotify-connect._tcp.local. (45)
15:13:07.279168 IP6 fe80::7ac9:20a1:db14:bb9a.mdns > ff02::fb.mdns: 0 PTR (QM)? _spotify-connect._tcp.local. (45)
15:13:10.813377 IP 192.168.56.1.60342 > 239.255.255.250.1900: UDP, length 125
15:13:27.693847 IP 192.168.56.1.57621 > 192.168.56.255.57621: UDP, length 44
15:13:39.591003 IP 192.168.56.1.51448 > 239.255.255.250.1900: UDP, length 170
15:13:40.591691 IP 192.168.56.1.51448 > 239.255.255.250.1900: UDP, length 170
15:13:41.591843 IP 192.168.56.1.51448 > 239.255.255.250.1900: UDP, length 170
15:13:42.592586 IP 192.168.56.1.51448 > 239.255.255.250.1900: UDP, length 170
15:13:48.719364 IP 192.168.56.1.51450 > 239.255.255.250.1900: UDP, length 175
15:13:49.720437 IP 192.168.56.1.51450 > 239.255.255.250.1900: UDP, length 175
15:13:50.720658 IP 192.168.56.1.51450 > 239.255.255.250.1900: UDP, length 175
15:13:51.721199 IP 192.168.56.1.51450 > 239.255.255.250.1900: UDP, length 175
15:13:57.693954 IP 192.168.56.1.57621 > 192.168.56.255.57621: UDP, length 44
15:14:27.694364 IP 192.168.56.1.57621 > 192.168.56.255.57621: UDP, length 44
15:14:57.693872 IP 192.168.56.1.57621 > 192.168.56.255.57621: UDP, length 44
15:15:07.274329 IP 192.168.56.1.mdns > mdns.mcast.net.mdns: 0 PTR (QM)? _spotify-connect._tcp.local. (45)
15:15:07.276441 IP6 fe80::7ac9:20a1:db14:bb9a.mdns > ff02::fb.mdns: 0 PTR (QM)? _spotify-connect._tcp.local. (45)
15:15:08.383763 IP server1.bootpc > 192.168.56.100.bootps: BOOTP/DHCP, Request from 08:00:27:86:f6:1f (oui Unknown), length 285
15:15:08.392079 IP 192.168.56.100.bootps > server1.bootpc: BOOTP/DHCP, Reply, length 548
15:15:10.812655 IP 192.168.56.1.60342 > 239.255.255.250.1900: UDP, length 125
15:15:13.682549 ARP, Request who-has 192.168.56.100 tell server1, length 28
15:15:13.683208 ARP, Reply 192.168.56.100 is-at 08:00:27:0d:b2:d3 (oui Unknown), length 46
15:15:27.694086 IP 192.168.56.1.57621 > 192.168.56.255.57621: UDP, length 44
15:15:39.589478 IP 192.168.56.1.65296 > 239.255.255.250.1900: UDP, length 170
15:15:40.590739 IP 192.168.56.1.65296 > 239.255.255.250.1900: UDP, length 170
15:15:41.590861 IP 192.168.56.1.65296 > 239.255.255.250.1900: UDP, length 170
15:15:42.591283 IP 192.168.56.1.65296 > 239.255.255.250.1900: UDP, length 170
15:15:48.717946 IP 192.168.56.1.65298 > 239.255.255.250.1900: UDP, length 175
15:15:49.720134 IP 192.168.56.1.65298 > 239.255.255.250.1900: UDP, length 175
15:15:50.720663 IP 192.168.56.1.65298 > 239.255.255.250.1900: UDP, length 175
15:15:51.721031 IP 192.168.56.1.65298 > 239.255.255.250.1900: UDP, length 175
15:15:57.693611 IP 192.168.56.1.57621 > 192.168.56.255.57621: UDP, length 44
15:16:27.694739 IP 192.168.56.1.57621 > 192.168.56.255.57621: UDP, length 44
15:16:57.694686 IP 192.168.56.1.57621 > 192.168.56.255.57621: UDP, length 44
15:17:07.272420 IP 192.168.56.1.mdns > mdns.mcast.net.mdns: 0 PTR (QM)? _spotify-connect._tcp.local. (45)
15:17:07.275302 IP6 fe80::7ac9:20a1:db14:bb9a.mdns > ff02::fb.mdns: 0 PTR (QM)? _spotify-connect._tcp.local. (45)
15:17:10.811964 IP 192.168.56.1.60342 > 239.255.255.250.1900: UDP, length 125
15:17:27.693714 IP 192.168.56.1.57621 > 192.168.56.255.57621: UDP, length 44
15:17:39.587992 IP 192.168.56.1.65178 > 239.255.255.250.1900: UDP, length 170
15:17:40.589041 IP 192.168.56.1.65178 > 239.255.255.250.1900: UDP, length 170
15:17:41.589680 IP 192.168.56.1.65178 > 239.255.255.250.1900: UDP, length 170
15:17:42.590565 IP 192.168.56.1.65178 > 239.255.255.250.1900: UDP, length 170
15:17:48.716971 IP 192.168.56.1.65180 > 239.255.255.250.1900: UDP, length 175
15:17:49.718366 IP 192.168.56.1.65180 > 239.255.255.250.1900: UDP, length 175
15:17:50.719342 IP 192.168.56.1.65180 > 239.255.255.250.1900: UDP, length 175
15:17:51.719668 IP 192.168.56.1.65180 > 239.255.255.250.1900: UDP, length 175
15:17:57.693876 IP 192.168.56.1.57621 > 192.168.56.255.57621: UDP, length 44
15:18:27.694298 IP 192.168.56.1.57621 > 192.168.56.255.57621: UDP, length 44
15:18:57.695230 IP 192.168.56.1.57621 > 192.168.56.255.57621: UDP, length 44
15:19:07.272138 IP 192.168.56.1.mdns > mdns.mcast.net.mdns: 0 PTR (QM)? _spotify-connect._tcp.local. (45)
15:19:07.282762 IP6 fe80::7ac9:20a1:db14:bb9a.mdns > ff02::fb.mdns: 0 PTR (QM)? _spotify-connect._tcp.local. (45)
15:19:10.812142 IP 192.168.56.1.60342 > 239.255.255.250.1900: UDP, length 125
15:19:27.695494 IP 192.168.56.1.57621 > 192.168.56.255.57621: UDP, length 44
15:19:39.587880 IP 192.168.56.1.56263 > 239.255.255.250.1900: UDP, length 170
15:19:40.589927 IP 192.168.56.1.56263 > 239.255.255.250.1900: UDP, length 170
15:19:41.590919 IP 192.168.56.1.56263 > 239.255.255.250.1900: UDP, length 170
15:19:42.591528 IP 192.168.56.1.56263 > 239.255.255.250.1900: UDP, length 170
15:19:48.715920 IP 192.168.56.1.56266 > 239.255.255.250.1900: UDP, length 175
15:19:49.716998 IP 192.168.56.1.56266 > 239.255.255.250.1900: UDP, length 175
15:19:50.718396 IP 192.168.56.1.56266 > 239.255.255.250.1900: UDP, length 175
15:19:51.718426 IP 192.168.56.1.56266 > 239.255.255.250.1900: UDP, length 175
15:19:57.696086 IP 192.168.56.1.57621 > 192.168.56.255.57621: UDP, length 44
15:20:08.421266 IP server1.bootpc > 192.168.56.100.bootps: BOOTP/DHCP, Request from 08:00:27:86:f6:1f (oui Unknown), length 285
15:20:08.431482 IP 192.168.56.100.bootps > server1.bootpc: BOOTP/DHCP, Reply, length 548
15:20:13.703462 ARP, Request who-has 192.168.56.100 tell server1, length 28
15:20:13.704157 ARP, Reply 192.168.56.100 is-at 08:00:27:0d:b2:d3 (oui Unknown), length 46
15:20:27.696148 IP 192.168.56.1.57621 > 192.168.56.255.57621: UDP, length 44
15:20:57.697894 IP 192.168.56.1.57621 > 192.168.56.255.57621: UDP, length 44
15:21:07.269338 IP 192.168.56.1.mdns > mdns.mcast.net.mdns: 0 PTR (QM)? _spotify-connect._tcp.local. (45)
15:21:07.271637 IP6 fe80::7ac9:20a1:db14:bb9a.mdns > ff02::fb.mdns: 0 PTR (QM)? _spotify-connect._tcp.local. (45)
15:21:10.810844 IP 192.168.56.1.60342 > 239.255.255.250.1900: UDP, length 125
15:21:27.697901 IP 192.168.56.1.57621 > 192.168.56.255.57621: UDP, length 44
15:21:39.586883 IP 192.168.56.1.51862 > 239.255.255.250.1900: UDP, length 170
15:21:40.589391 IP 192.168.56.1.51862 > 239.255.255.250.1900: UDP, length 170
15:21:41.589808 IP 192.168.56.1.51862 > 239.255.255.250.1900: UDP, length 170
15:21:42.590035 IP 192.168.56.1.51862 > 239.255.255.250.1900: UDP, length 170
15:21:48.715786 IP 192.168.56.1.49393 > 239.255.255.250.1900: UDP, length 175
15:21:49.716848 IP 192.168.56.1.49393 > 239.255.255.250.1900: UDP, length 175
15:21:50.717683 IP 192.168.56.1.49393 > 239.255.255.250.1900: UDP, length 175
15:21:51.718538 IP 192.168.56.1.49393 > 239.255.255.250.1900: UDP, length 175
15:21:57.698631 IP 192.168.56.1.57621 > 192.168.56.255.57621: UDP, length 44
15:22:27.699519 IP 192.168.56.1.57621 > 192.168.56.255.57621: UDP, length 44
15:22:57.700075 IP 192.168.56.1.57621 > 192.168.56.255.57621: UDP, length 44
15:23:07.268822 IP 192.168.56.1.mdns > mdns.mcast.net.mdns: 0 PTR (QM)? _spotify-connect._tcp.local. (45)
15:23:07.271865 IP6 fe80::7ac9:20a1:db14:bb9a.mdns > ff02::fb.mdns: 0 PTR (QM)? _spotify-connect._tcp.local. (45)
15:23:10.808722 IP 192.168.56.1.60342 > 239.255.255.250.1900: UDP, length 125
15:23:27.701017 IP 192.168.56.1.57621 > 192.168.56.255.57621: UDP, length 44
15:23:39.584825 IP 192.168.56.1.64561 > 239.255.255.250.1900: UDP, length 170
15:23:40.586408 IP 192.168.56.1.64561 > 239.255.255.250.1900: UDP, length 170
15:23:41.587121 IP 192.168.56.1.64561 > 239.255.255.250.1900: UDP, length 170
15:23:42.587298 IP 192.168.56.1.64561 > 239.255.255.250.1900: UDP, length 170
15:23:48.706500 IP 192.168.56.1.55967 > 239.255.255.250.1900: UDP, length 175
15:23:49.707485 IP 192.168.56.1.55967 > 239.255.255.250.1900: UDP, length 175
15:23:50.708629 IP 192.168.56.1.55967 > 239.255.255.250.1900: UDP, length 175
15:23:51.708995 IP 192.168.56.1.55967 > 239.255.255.250.1900: UDP, length 175
15:23:57.700781 IP 192.168.56.1.57621 > 192.168.56.255.57621: UDP, length 44
15:24:23.933428 LLDP, length 46
15:24:27.700760 IP 192.168.56.1.57621 > 192.168.56.255.57621: UDP, length 44
15:24:57.700947 IP 192.168.56.1.57621 > 192.168.56.255.57621: UDP, length 44
15:25:07.268339 IP 192.168.56.1.mdns > mdns.mcast.net.mdns: 0 PTR (QM)? _spotify-connect._tcp.local. (45)
15:25:07.272222 IP6 fe80::7ac9:20a1:db14:bb9a.mdns > ff02::fb.mdns: 0 PTR (QM)? _spotify-connect._tcp.local. (45)
15:25:08.647989 IP server1.bootpc > 192.168.56.100.bootps: BOOTP/DHCP, Request from 08:00:27:86:f6:1f (oui Unknown), length 285
15:25:08.650886 IP 192.168.56.100.bootps > server1.bootpc: BOOTP/DHCP, Reply, length 548
15:25:10.808522 IP 192.168.56.1.60342 > 239.255.255.250.1900: UDP, length 125
15:25:13.671584 ARP, Request who-has 192.168.56.100 tell server1, length 28
15:25:13.671997 ARP, Reply 192.168.56.100 is-at 08:00:27:0d:b2:d3 (oui Unknown), length 46
15:25:27.700691 IP 192.168.56.1.57621 > 192.168.56.255.57621: UDP, length 44
15:25:39.587071 IP 192.168.56.1.62433 > 239.255.255.250.1900: UDP, length 170
15:25:40.589041 IP 192.168.56.1.62433 > 239.255.255.250.1900: UDP, length 170
15:25:41.589971 IP 192.168.56.1.62433 > 239.255.255.250.1900: UDP, length 170
15:25:42.591759 IP 192.168.56.1.62433 > 239.255.255.250.1900: UDP, length 170
15:25:48.714622 IP 192.168.56.1.49691 > 239.255.255.250.1900: UDP, length 175
15:25:49.715273 IP 192.168.56.1.49691 > 239.255.255.250.1900: UDP, length 175
15:25:50.715963 IP 192.168.56.1.49691 > 239.255.255.250.1900: UDP, length 175
15:25:51.716874 IP 192.168.56.1.49691 > 239.255.255.250.1900: UDP, length 175
15:25:57.702775 IP 192.168.56.1.57621 > 192.168.56.255.57621: UDP, length 44
15:26:27.702101 IP 192.168.56.1.57621 > 192.168.56.255.57621: UDP, length 44
15:26:57.703151 IP 192.168.56.1.57621 > 192.168.56.255.57621: UDP, length 44
15:27:07.277298 IP 192.168.56.1.mdns > mdns.mcast.net.mdns: 0 PTR (QM)? _spotify-connect._tcp.local. (45)
15:27:07.279637 IP6 fe80::7ac9:20a1:db14:bb9a.mdns > ff02::fb.mdns: 0 PTR (QM)? _spotify-connect._tcp.local. (45)
15:27:10.809173 IP 192.168.56.1.60342 > 239.255.255.250.1900: UDP, length 125
15:27:27.703990 IP 192.168.56.1.57621 > 192.168.56.255.57621: UDP, length 44
15:27:39.578430 IP 192.168.56.1.49502 > 239.255.255.250.1900: UDP, length 170
15:27:40.579430 IP 192.168.56.1.49502 > 239.255.255.250.1900: UDP, length 170
15:27:41.580136 IP 192.168.56.1.49502 > 239.255.255.250.1900: UDP, length 170
15:27:42.582117 IP 192.168.56.1.49502 > 239.255.255.250.1900: UDP, length 170
15:27:48.718727 IP 192.168.56.1.62504 > 239.255.255.250.1900: UDP, length 175
15:27:49.719618 IP 192.168.56.1.62504 > 239.255.255.250.1900: UDP, length 175
15:27:50.719651 IP 192.168.56.1.62504 > 239.255.255.250.1900: UDP, length 175
15:27:51.720304 IP 192.168.56.1.62504 > 239.255.255.250.1900: UDP, length 175
15:27:57.705340 IP 192.168.56.1.57621 > 192.168.56.255.57621: UDP, length 44
15:28:27.705847 IP 192.168.56.1.57621 > 192.168.56.255.57621: UDP, length 44
15:28:57.705923 IP 192.168.56.1.57621 > 192.168.56.255.57621: UDP, length 44
15:29:07.266395 IP 192.168.56.1.mdns > mdns.mcast.net.mdns: 0 PTR (QM)? _spotify-connect._tcp.local. (45)
15:29:07.269240 IP6 fe80::7ac9:20a1:db14:bb9a.mdns > ff02::fb.mdns: 0 PTR (QM)? _spotify-connect._tcp.local. (45)
15:29:10.808173 IP 192.168.56.1.60342 > 239.255.255.250.1900: UDP, length 125
15:29:27.707039 IP 192.168.56.1.57621 > 192.168.56.255.57621: UDP, length 44
15:29:39.579266 IP 192.168.56.1.63397 > 239.255.255.250.1900: UDP, length 170
15:29:40.579996 IP 192.168.56.1.63397 > 239.255.255.250.1900: UDP, length 170
15:29:41.580506 IP 192.168.56.1.63397 > 239.255.255.250.1900: UDP, length 170
15:29:42.580695 IP 192.168.56.1.63397 > 239.255.255.250.1900: UDP, length 170
15:29:48.715123 IP 192.168.56.1.49804 > 239.255.255.250.1900: UDP, length 175
15:29:49.716789 IP 192.168.56.1.49804 > 239.255.255.250.1900: UDP, length 175
15:29:50.718225 IP 192.168.56.1.49804 > 239.255.255.250.1900: UDP, length 175
15:29:51.718133 IP 192.168.56.1.49804 > 239.255.255.250.1900: UDP, length 175
15:29:57.707333 IP 192.168.56.1.57621 > 192.168.56.255.57621: UDP, length 44
15:30:08.737111 IP server1.bootpc > 192.168.56.100.bootps: BOOTP/DHCP, Request from 08:00:27:86:f6:1f (oui Unknown), length 285
15:30:08.740449 IP 192.168.56.100.bootps > server1.bootpc: BOOTP/DHCP, Reply, length 548
15:30:13.959856 ARP, Request who-has 192.168.56.100 tell server1, length 28
15:30:13.960277 ARP, Reply 192.168.56.100 is-at 08:00:27:0d:b2:d3 (oui Unknown), length 46
15:30:27.709083 IP 192.168.56.1.57621 > 192.168.56.255.57621: UDP, length 44
15:30:57.715530 IP 192.168.56.1.57621 > 192.168.56.255.57621: UDP, length 44
15:31:07.266207 IP 192.168.56.1.mdns > mdns.mcast.net.mdns: 0 PTR (QM)? _spotify-connect._tcp.local. (45)
15:31:07.268687 IP6 fe80::7ac9:20a1:db14:bb9a.mdns > ff02::fb.mdns: 0 PTR (QM)? _spotify-connect._tcp.local. (45)
15:31:10.807779 IP 192.168.56.1.60342 > 239.255.255.250.1900: UDP, length 125
15:31:11.050490 IP 192.168.56.1.51776 > 239.255.255.250.1900: UDP, length 137
15:31:14.051203 IP 192.168.56.1.51776 > 239.255.255.250.1900: UDP, length 137
15:31:17.059413 IP 192.168.56.1.51776 > 239.255.255.250.1900: UDP, length 137
15:31:27.710628 IP 192.168.56.1.57621 > 192.168.56.255.57621: UDP, length 44
15:31:39.587854 IP 192.168.56.1.56562 > 239.255.255.250.1900: UDP, length 170
15:31:40.588512 IP 192.168.56.1.56562 > 239.255.255.250.1900: UDP, length 170
15:31:41.588919 IP 192.168.56.1.56562 > 239.255.255.250.1900: UDP, length 170
15:31:42.589414 IP 192.168.56.1.56562 > 239.255.255.250.1900: UDP, length 170
15:31:48.714354 IP 192.168.56.1.58498 > 239.255.255.250.1900: UDP, length 175
15:31:49.715560 IP 192.168.56.1.58498 > 239.255.255.250.1900: UDP, length 175
15:31:50.715856 IP 192.168.56.1.58498 > 239.255.255.250.1900: UDP, length 175
15:31:51.716449 IP 192.168.56.1.58498 > 239.255.255.250.1900: UDP, length 175
15:31:57.711543 IP 192.168.56.1.57621 > 192.168.56.255.57621: UDP, length 44
15:31:58.782868 IP6 fe80::5f2c:50a7:b36:4049.mdns > ff02::fb.mdns: 0 [7q] PTR (QM)? _ftp._tcp.local. PTR (QM)? _nfs._tcp.local. PTR (QM)? _afpovertcp._tcp.local. PTR (QM)? _smb._tcp.local. PTR (QM)? _sftp-ssh._tcp.local. PTR (QM)? _webdavs._tcp.local. PTR (QM)? _webdav._tcp.local. (118)
15:31:58.783859 IP 192.168.56.117.mdns > mdns.mcast.net.mdns: 0 [7q] PTR (QM)? _ftp._tcp.local. PTR (QM)? _nfs._tcp.local. PTR (QM)? _afpovertcp._tcp.local. PTR (QM)? _smb._tcp.local. PTR (QM)? _sftp-ssh._tcp.local. PTR (QM)? _webdavs._tcp.local. PTR (QM)? _webdav._tcp.local. (118)
15:32:27.711378 IP 192.168.56.1.57621 > 192.168.56.255.57621: UDP, length 44
15:32:57.711758 IP 192.168.56.1.57621 > 192.168.56.255.57621: UDP, length 44
15:33:07.265605 IP 192.168.56.1.mdns > mdns.mcast.net.mdns: 0 PTR (QM)? _spotify-connect._tcp.local. (45)
15:33:07.268609 IP6 fe80::7ac9:20a1:db14:bb9a.mdns > ff02::fb.mdns: 0 PTR (QM)? _spotify-connect._tcp.local. (45)
15:33:10.812897 IP 192.168.56.1.60342 > 239.255.255.250.1900: UDP, length 125
15:33:27.713007 IP 192.168.56.1.57621 > 192.168.56.255.57621: UDP, length 44
15:33:39.588208 IP 192.168.56.1.55801 > 239.255.255.250.1900: UDP, length 170
15:33:40.589897 IP 192.168.56.1.55801 > 239.255.255.250.1900: UDP, length 170
15:33:41.590741 IP 192.168.56.1.55801 > 239.255.255.250.1900: UDP, length 170
15:33:42.590833 IP 192.168.56.1.55801 > 239.255.255.250.1900: UDP, length 170
15:33:48.714731 IP 192.168.56.1.59735 > 239.255.255.250.1900: UDP, length 175
15:33:49.717154 IP 192.168.56.1.59735 > 239.255.255.250.1900: UDP, length 175
15:33:50.718095 IP 192.168.56.1.59735 > 239.255.255.250.1900: UDP, length 175
15:33:51.719138 IP 192.168.56.1.59735 > 239.255.255.250.1900: UDP, length 175
15:33:57.715218 IP 192.168.56.1.57621 > 192.168.56.255.57621: UDP, length 44
15:34:27.713750 IP 192.168.56.1.57621 > 192.168.56.255.57621: UDP, length 44
15:34:57.713794 IP 192.168.56.1.57621 > 192.168.56.255.57621: UDP, length 44
15:35:07.264464 IP 192.168.56.1.mdns > mdns.mcast.net.mdns: 0 PTR (QM)? _spotify-connect._tcp.local. (45)
15:35:07.267857 IP6 fe80::7ac9:20a1:db14:bb9a.mdns > ff02::fb.mdns: 0 PTR (QM)? _spotify-connect._tcp.local. (45)
15:35:08.738055 IP server1.bootpc > 192.168.56.100.bootps: BOOTP/DHCP, Request from 08:00:27:86:f6:1f (oui Unknown), length 285
15:35:08.748023 IP 192.168.56.100.bootps > server1.bootpc: BOOTP/DHCP, Reply, length 548
15:35:10.806487 IP 192.168.56.1.60342 > 239.255.255.250.1900: UDP, length 125
15:35:14.060754 ARP, Request who-has 192.168.56.100 tell server1, length 28
15:35:14.061148 ARP, Reply 192.168.56.100 is-at 08:00:27:0d:b2:d3 (oui Unknown), length 46
15:35:27.714200 IP 192.168.56.1.57621 > 192.168.56.255.57621: UDP, length 44
15:35:39.588733 IP 192.168.56.1.60963 > 239.255.255.250.1900: UDP, length 170
15:35:40.589582 IP 192.168.56.1.60963 > 239.255.255.250.1900: UDP, length 170
15:35:41.590076 IP 192.168.56.1.60963 > 239.255.255.250.1900: UDP, length 170
15:35:42.591011 IP 192.168.56.1.60963 > 239.255.255.250.1900: UDP, length 170
15:35:48.714589 IP 192.168.56.1.60965 > 239.255.255.250.1900: UDP, length 175
15:35:49.716734 IP 192.168.56.1.60965 > 239.255.255.250.1900: UDP, length 175
15:35:50.718015 IP 192.168.56.1.60965 > 239.255.255.250.1900: UDP, length 175
15:35:51.718202 IP 192.168.56.1.60965 > 239.255.255.250.1900: UDP, length 175
15:35:57.715168 IP 192.168.56.1.57621 > 192.168.56.255.57621: UDP, length 44
15:36:27.716096 IP 192.168.56.1.57621 > 192.168.56.255.57621: UDP, length 44
15:36:57.716224 IP 192.168.56.1.57621 > 192.168.56.255.57621: UDP, length 44
15:37:07.265385 IP 192.168.56.1.mdns > mdns.mcast.net.mdns: 0 PTR (QM)? _spotify-connect._tcp.local. (45)
15:37:07.269029 IP6 fe80::7ac9:20a1:db14:bb9a.mdns > ff02::fb.mdns: 0 PTR (QM)? _spotify-connect._tcp.local. (45)
15:37:10.805824 IP 192.168.56.1.60342 > 239.255.255.250.1900: UDP, length 125
15:37:27.716690 IP 192.168.56.1.57621 > 192.168.56.255.57621: UDP, length 44
15:37:39.589549 IP 192.168.56.1.62033 > 239.255.255.250.1900: UDP, length 170
15:37:40.591028 IP 192.168.56.1.62033 > 239.255.255.250.1900: UDP, length 170
15:37:41.591133 IP 192.168.56.1.62033 > 239.255.255.250.1900: UDP, length 170
15:37:42.592075 IP 192.168.56.1.62033 > 239.255.255.250.1900: UDP, length 170
15:37:48.713995 IP 192.168.56.1.62035 > 239.255.255.250.1900: UDP, length 175
15:37:49.716556 IP 192.168.56.1.62035 > 239.255.255.250.1900: UDP, length 175
15:37:50.717130 IP 192.168.56.1.62035 > 239.255.255.250.1900: UDP, length 175
15:37:51.717213 IP 192.168.56.1.62035 > 239.255.255.250.1900: UDP, length 175
15:37:57.717466 IP 192.168.56.1.57621 > 192.168.56.255.57621: UDP, length 44
15:38:27.718335 IP 192.168.56.1.57621 > 192.168.56.255.57621: UDP, length 44
15:38:57.719113 IP 192.168.56.1.57621 > 192.168.56.255.57621: UDP, length 44
15:39:07.263442 IP 192.168.56.1.mdns > mdns.mcast.net.mdns: 0 PTR (QM)? _spotify-connect._tcp.local. (45)
15:39:07.266025 IP6 fe80::7ac9:20a1:db14:bb9a.mdns > ff02::fb.mdns: 0 PTR (QM)? _spotify-connect._tcp.local. (45)
15:39:10.807721 IP 192.168.56.1.60342 > 239.255.255.250.1900: UDP, length 125
15:39:27.728612 IP 192.168.56.1.57621 > 192.168.56.255.57621: UDP, length 44
15:39:39.590057 IP 192.168.56.1.59474 > 239.255.255.250.1900: UDP, length 170
15:39:40.590852 IP 192.168.56.1.59474 > 239.255.255.250.1900: UDP, length 170
15:39:41.591324 IP 192.168.56.1.59474 > 239.255.255.250.1900: UDP, length 170
15:39:42.592202 IP 192.168.56.1.59474 > 239.255.255.250.1900: UDP, length 170
15:39:48.713638 IP 192.168.56.1.54902 > 239.255.255.250.1900: UDP, length 175
15:39:49.714663 IP 192.168.56.1.54902 > 239.255.255.250.1900: UDP, length 175
15:39:50.715183 IP 192.168.56.1.54902 > 239.255.255.250.1900: UDP, length 175
15:39:51.716235 IP 192.168.56.1.54902 > 239.255.255.250.1900: UDP, length 175
15:39:57.719292 IP 192.168.56.1.57621 > 192.168.56.255.57621: UDP, length 44
15:40:08.751446 IP server1.bootpc > 192.168.56.100.bootps: BOOTP/DHCP, Request from 08:00:27:86:f6:1f (oui Unknown), length 285
15:40:08.760115 IP 192.168.56.100.bootps > server1.bootpc: BOOTP/DHCP, Reply, length 548
15:40:08.774060 LLDP, length 46
15:40:13.844087 ARP, Request who-has 192.168.56.100 tell server1, length 28
15:40:13.844481 ARP, Reply 192.168.56.100 is-at 08:00:27:0d:b2:d3 (oui Unknown), length 46
15:40:27.720320 IP 192.168.56.1.57621 > 192.168.56.255.57621: UDP, length 44
15:40:57.721172 IP 192.168.56.1.57621 > 192.168.56.255.57621: UDP, length 44
15:41:07.262238 IP 192.168.56.1.mdns > mdns.mcast.net.mdns: 0 PTR (QM)? _spotify-connect._tcp.local. (45)
15:41:07.265147 IP6 fe80::7ac9:20a1:db14:bb9a.mdns > ff02::fb.mdns: 0 PTR (QM)? _spotify-connect._tcp.local. (45)
15:41:10.807656 IP 192.168.56.1.60342 > 239.255.255.250.1900: UDP, length 125
15:41:27.724525 IP 192.168.56.1.57621 > 192.168.56.255.57621: UDP, length 44
15:41:39.590573 IP 192.168.56.1.60945 > 239.255.255.250.1900: UDP, length 170
15:41:40.592366 IP 192.168.56.1.60945 > 239.255.255.250.1900: UDP, length 170
15:41:41.592570 IP 192.168.56.1.60945 > 239.255.255.250.1900: UDP, length 170
15:41:42.592999 IP 192.168.56.1.60945 > 239.255.255.250.1900: UDP, length 170
15:41:48.713596 IP 192.168.56.1.60947 > 239.255.255.250.1900: UDP, length 175
15:41:49.714138 IP 192.168.56.1.60947 > 239.255.255.250.1900: UDP, length 175
15:41:50.715994 IP 192.168.56.1.60947 > 239.255.255.250.1900: UDP, length 175
15:41:51.716453 IP 192.168.56.1.60947 > 239.255.255.250.1900: UDP, length 175
15:41:57.723739 IP 192.168.56.1.57621 > 192.168.56.255.57621: UDP, length 44
15:42:27.724665 IP 192.168.56.1.57621 > 192.168.56.255.57621: UDP, length 44
15:42:57.725766 IP 192.168.56.1.57621 > 192.168.56.255.57621: UDP, length 44
15:43:07.262636 IP 192.168.56.1.mdns > mdns.mcast.net.mdns: 0 PTR (QM)? _spotify-connect._tcp.local. (45)
15:43:07.265172 IP6 fe80::7ac9:20a1:db14:bb9a.mdns > ff02::fb.mdns: 0 PTR (QM)? _spotify-connect._tcp.local. (45)
15:43:10.808577 IP 192.168.56.1.60342 > 239.255.255.250.1900: UDP, length 125
15:43:27.727912 IP 192.168.56.1.57621 > 192.168.56.255.57621: UDP, length 44
15:43:39.590663 IP 192.168.56.1.49650 > 239.255.255.250.1900: UDP, length 170
15:43:40.593114 IP 192.168.56.1.49650 > 239.255.255.250.1900: UDP, length 170
15:43:41.593679 IP 192.168.56.1.49650 > 239.255.255.250.1900: UDP, length 170
15:43:42.594902 IP 192.168.56.1.49650 > 239.255.255.250.1900: UDP, length 170
15:43:48.713099 IP 192.168.56.1.62227 > 239.255.255.250.1900: UDP, length 175
15:43:49.715114 IP 192.168.56.1.62227 > 239.255.255.250.1900: UDP, length 175
15:43:50.716826 IP 192.168.56.1.62227 > 239.255.255.250.1900: UDP, length 175
15:43:51.717775 IP 192.168.56.1.62227 > 239.255.255.250.1900: UDP, length 175
15:43:57.728134 IP 192.168.56.1.57621 > 192.168.56.255.57621: UDP, length 44
15:44:27.734782 IP 192.168.56.1.57621 > 192.168.56.255.57621: UDP, length 44
15:44:57.729600 IP 192.168.56.1.57621 > 192.168.56.255.57621: UDP, length 44
15:45:07.261366 IP 192.168.56.1.mdns > mdns.mcast.net.mdns: 0 PTR (QM)? _spotify-connect._tcp.local. (45)
15:45:07.263836 IP6 fe80::7ac9:20a1:db14:bb9a.mdns > ff02::fb.mdns: 0 PTR (QM)? _spotify-connect._tcp.local. (45)
15:45:08.769670 IP server1.bootpc > 192.168.56.100.bootps: BOOTP/DHCP, Request from 08:00:27:86:f6:1f (oui Unknown), length 285
15:45:08.778317 IP 192.168.56.100.bootps > server1.bootpc: BOOTP/DHCP, Reply, length 548
15:45:10.811641 IP 192.168.56.1.60342 > 239.255.255.250.1900: UDP, length 125
15:45:13.800218 ARP, Request who-has 192.168.56.100 tell server1, length 28
15:45:13.800815 ARP, Reply 192.168.56.100 is-at 08:00:27:0d:b2:d3 (oui Unknown), length 46
15:45:27.728698 IP 192.168.56.1.57621 > 192.168.56.255.57621: UDP, length 44
15:45:39.587348 IP 192.168.56.1.55316 > 239.255.255.250.1900: UDP, length 170
15:45:40.589303 IP 192.168.56.1.55316 > 239.255.255.250.1900: UDP, length 170
15:45:41.589837 IP 192.168.56.1.55316 > 239.255.255.250.1900: UDP, length 170
15:45:42.590680 IP 192.168.56.1.55316 > 239.255.255.250.1900: UDP, length 170
15:45:48.703651 IP 192.168.56.1.59654 > 239.255.255.250.1900: UDP, length 175
15:45:49.705440 IP 192.168.56.1.59654 > 239.255.255.250.1900: UDP, length 175
15:45:50.706775 IP 192.168.56.1.59654 > 239.255.255.250.1900: UDP, length 175
15:45:51.706946 IP 192.168.56.1.59654 > 239.255.255.250.1900: UDP, length 175
15:45:57.727174 IP 192.168.56.1.57621 > 192.168.56.255.57621: UDP, length 44
15:46:27.725620 IP 192.168.56.1.57621 > 192.168.56.255.57621: UDP, length 44
15:46:57.723935 IP 192.168.56.1.57621 > 192.168.56.255.57621: UDP, length 44
15:47:07.254087 IP 192.168.56.1.mdns > mdns.mcast.net.mdns: 0 PTR (QM)? _spotify-connect._tcp.local. (45)
15:47:07.257207 IP6 fe80::7ac9:20a1:db14:bb9a.mdns > ff02::fb.mdns: 0 PTR (QM)? _spotify-connect._tcp.local. (45)
15:47:10.804353 IP 192.168.56.1.60342 > 239.255.255.250.1900: UDP, length 125
15:47:27.723251 IP 192.168.56.1.57621 > 192.168.56.255.57621: UDP, length 44
15:47:39.580926 IP 192.168.56.1.62832 > 239.255.255.250.1900: UDP, length 170
15:47:40.582854 IP 192.168.56.1.62832 > 239.255.255.250.1900: UDP, length 170
15:47:41.582803 IP 192.168.56.1.62832 > 239.255.255.250.1900: UDP, length 170
15:47:42.583477 IP 192.168.56.1.62832 > 239.255.255.250.1900: UDP, length 170
15:47:48.703117 IP 192.168.56.1.54076 > 239.255.255.250.1900: UDP, length 175
15:47:49.703904 IP 192.168.56.1.54076 > 239.255.255.250.1900: UDP, length 175
15:47:50.703888 IP 192.168.56.1.54076 > 239.255.255.250.1900: UDP, length 175
15:47:51.704784 IP 192.168.56.1.54076 > 239.255.255.250.1900: UDP, length 175
15:47:57.731443 IP 192.168.56.1.57621 > 192.168.56.255.57621: UDP, length 44
15:48:14.721537 IP6 fe80::5f2c:50a7:b36:4049.mdns > ff02::fb.mdns: 0 [2q] PTR (QM)? _ipps._tcp.local. PTR (QM)? _ipp._tcp.local. (45)
15:48:14.722353 IP 192.168.56.117.mdns > mdns.mcast.net.mdns: 0 [2q] PTR (QM)? _ipps._tcp.local. PTR (QM)? _ipp._tcp.local. (45)
15:48:15.169797 IP6 server1.mdns > ff02::fb.mdns: 0 [2q] PTR (QM)? _ipps._tcp.local. PTR (QM)? _ipp._tcp.local. (45)
15:48:15.170016 IP server1.mdns > mdns.mcast.net.mdns: 0 [2q] PTR (QM)? _ipps._tcp.local. PTR (QM)? _ipp._tcp.local. (45)
15:48:27.720875 IP 192.168.56.1.57621 > 192.168.56.255.57621: UDP, length 44
15:48:57.727461 IP 192.168.56.1.57621 > 192.168.56.255.57621: UDP, length 44
15:49:07.246825 IP 192.168.56.1.mdns > mdns.mcast.net.mdns: 0 PTR (QM)? _spotify-connect._tcp.local. (45)
15:49:07.249684 IP6 fe80::7ac9:20a1:db14:bb9a.mdns > ff02::fb.mdns: 0 PTR (QM)? _spotify-connect._tcp.local. (45)
15:49:10.799112 IP 192.168.56.1.60342 > 239.255.255.250.1900: UDP, length 125
15:49:27.719178 IP 192.168.56.1.57621 > 192.168.56.255.57621: UDP, length 44
15:49:39.567008 IP 192.168.56.1.63676 > 239.255.255.250.1900: UDP, length 170
15:49:40.568548 IP 192.168.56.1.63676 > 239.255.255.250.1900: UDP, length 170
15:49:41.568223 IP 192.168.56.1.63676 > 239.255.255.250.1900: UDP, length 170
15:49:42.569025 IP 192.168.56.1.63676 > 239.255.255.250.1900: UDP, length 170
15:49:48.698732 IP 192.168.56.1.59643 > 239.255.255.250.1900: UDP, length 175
15:49:49.698986 IP 192.168.56.1.59643 > 239.255.255.250.1900: UDP, length 175
15:49:50.700479 IP 192.168.56.1.59643 > 239.255.255.250.1900: UDP, length 175
15:49:51.700474 IP 192.168.56.1.59643 > 239.255.255.250.1900: UDP, length 175
15:49:57.724880 IP 192.168.56.1.57621 > 192.168.56.255.57621: UDP, length 44
15:50:08.789266 IP server1.bootpc > 192.168.56.100.bootps: BOOTP/DHCP, Request from 08:00:27:86:f6:1f (oui Unknown), length 285
15:50:08.797739 IP 192.168.56.100.bootps > server1.bootpc: BOOTP/DHCP, Reply, length 548
15:50:13.899339 ARP, Request who-has 192.168.56.100 tell server1, length 28
15:50:13.899982 ARP, Reply 192.168.56.100 is-at 08:00:27:0d:b2:d3 (oui Unknown), length 46
15:50:27.719193 IP 192.168.56.1.57621 > 192.168.56.255.57621: UDP, length 44
15:50:57.718136 IP 192.168.56.1.57621 > 192.168.56.255.57621: UDP, length 44
15:51:07.241467 IP 192.168.56.1.mdns > mdns.mcast.net.mdns: 0 PTR (QM)? _spotify-connect._tcp.local. (45)
15:51:07.244755 IP6 fe80::7ac9:20a1:db14:bb9a.mdns > ff02::fb.mdns: 0 PTR (QM)? _spotify-connect._tcp.local. (45)
15:51:10.793534 IP 192.168.56.1.60342 > 239.255.255.250.1900: UDP, length 125
15:51:27.717076 IP 192.168.56.1.57621 > 192.168.56.255.57621: UDP, length 44
15:51:39.562147 IP 192.168.56.1.49832 > 239.255.255.250.1900: UDP, length 170
15:51:40.563665 IP 192.168.56.1.49832 > 239.255.255.250.1900: UDP, length 170
15:51:41.563829 IP 192.168.56.1.49832 > 239.255.255.250.1900: UDP, length 170
15:51:42.566545 IP 192.168.56.1.49832 > 239.255.255.250.1900: UDP, length 170
15:51:48.693966 IP 192.168.56.1.64530 > 239.255.255.250.1900: UDP, length 175
15:51:49.694437 IP 192.168.56.1.64530 > 239.255.255.250.1900: UDP, length 175
15:51:50.695367 IP 192.168.56.1.64530 > 239.255.255.250.1900: UDP, length 175
15:51:51.696030 IP 192.168.56.1.64530 > 239.255.255.250.1900: UDP, length 175
15:51:57.716844 IP 192.168.56.1.57621 > 192.168.56.255.57621: UDP, length 44
15:52:27.716995 IP 192.168.56.1.57621 > 192.168.56.255.57621: UDP, length 44
15:52:57.715970 IP 192.168.56.1.57621 > 192.168.56.255.57621: UDP, length 44
15:53:07.236756 IP 192.168.56.1.mdns > mdns.mcast.net.mdns: 0 PTR (QM)? _spotify-connect._tcp.local. (45)
15:53:07.239580 IP6 fe80::7ac9:20a1:db14:bb9a.mdns > ff02::fb.mdns: 0 PTR (QM)? _spotify-connect._tcp.local. (45)
15:53:10.790146 IP 192.168.56.1.60342 > 239.255.255.250.1900: UDP, length 125
15:53:27.715628 IP 192.168.56.1.57621 > 192.168.56.255.57621: UDP, length 44
15:53:39.567317 IP 192.168.56.1.52917 > 239.255.255.250.1900: UDP, length 170
15:53:40.569033 IP 192.168.56.1.52917 > 239.255.255.250.1900: UDP, length 170
15:53:41.569928 IP 192.168.56.1.52917 > 239.255.255.250.1900: UDP, length 170
15:53:42.571778 IP 192.168.56.1.52917 > 239.255.255.250.1900: UDP, length 170
15:53:48.691733 IP 192.168.56.1.52919 > 239.255.255.250.1900: UDP, length 175
15:53:49.692537 IP 192.168.56.1.52919 > 239.255.255.250.1900: UDP, length 175
15:53:50.694553 IP 192.168.56.1.52919 > 239.255.255.250.1900: UDP, length 175
15:53:51.695041 IP 192.168.56.1.52919 > 239.255.255.250.1900: UDP, length 175
15:53:57.715822 IP 192.168.56.1.57621 > 192.168.56.255.57621: UDP, length 44
15:54:23.344491 IP 192.168.56.1.mdns > mdns.mcast.net.mdns: 0 PTR (QM)? _sleep-proxy._udp.local. (41)
15:54:27.715354 IP 192.168.56.1.57621 > 192.168.56.255.57621: UDP, length 44
15:54:57.715253 IP 192.168.56.1.57621 > 192.168.56.255.57621: UDP, length 44
15:55:07.226656 IP 192.168.56.1.mdns > mdns.mcast.net.mdns: 0 PTR (QM)? _spotify-connect._tcp.local. (45)
15:55:07.228034 IP6 fe80::7ac9:20a1:db14:bb9a.mdns > ff02::fb.mdns: 0 PTR (QM)? _spotify-connect._tcp.local. (45)

